,Title,Agency,Department,Department_code,Techniques,Summary,Processed_Summary,Cluster,topics
606,Medicaid And CHIP Financial (MACFin) Anomaly Detection Model for DSH Audit,Centers for Medicare & Medicaid Services (CMS),Department of Health and Human Services,HHS,"MACHINE LEARNING, AI","MACFin AI team developed machine learning model to predict anomalies within DSH audit data. The model flags top outliers in the submitted DSH hospitals data in terms of extreme behavior in the data based on amounts and other characteristics of the data to isolate the most outliers in the data. For example, out of all DSH allocations, the model can identify the top 1-5% outliers in the data for further review and auditing. Such model facilitates targeted investigations for gaps and barriers. In addition, the model can support the process by minimizing overpayment and/or underpayment and amounts redistribution",macfin ai team developed machine learning model predict anomalies within dsh audit data model flags top outliers submitted dsh hospitals data terms extreme behavior data based amounts characteristics data isolate outliers data example dsh allocations model identify top outliers data review auditing model facilitates targeted investigations gaps barriers addition model support process minimizing overpayment underpayment amounts redistribution,1,Topic: Program integrity
607,Medicaid And CHIP Financial (MACFin) DSH Payment Forecasting model,Centers for Medicare & Medicaid Services (CMS),Department of Health and Human Services,HHS,MACHINE LEARNING,"Forecasting model to predict future DSH payment (next 1 year) based on historical data and trends (ex: last 1-3 years). Multiple models were trained based on time series (i.e., statistical models) and machine learning based model and compared for best performance in terms of average means error on DSH payment amount across all hospitals. DSH data were highly disorganized, the team spent time cleaning and combing the data from over 6 years for all states to conduct full model implementation and meaningful analysis. Predicting future DSH payment facilitates early planning and recommendations around trends, redistributions, etc. Modified models can also be built to predict other DSH-related metrics like payment-to-uncompensated ratio, underpayment, or overpayment",forecasting model predict future dsh payment next year based historical data trends ex last years multiple models trained based time series statistical models machine learning based model compared best performance terms average means error dsh payment amount across hospitals dsh data highly disorganized team spent time cleaning combing data years states conduct full model implementation meaningful analysis predicting future dsh payment facilitates early planning recommendations around trends redistributions etc modified models also built predict metrics like ratio underpayment overpayment,1,Service delivery
608,Performance Metrics Database and Analytics (PMDA),Centers for Medicare & Medicaid Services (CMS),Department of Health and Human Services,HHS,AI,PMDA AI for Anomaly Detection and Correction| Language Interpretation and Translation| Knowledge Management,pmda ai anomaly detection language interpretation knowledge management,12,"""Service Delivery"""
609,"Relationships, Events, Contacts, and Outreach Network (RECON)",Centers for Medicare & Medicaid Services (CMS),Department of Health and Human Services,HHS,AI,RECON AI for Recommender System| Sentiment Analysis,recon ai recommender sentiment analysis,12,Service Delivery
610,Risk Adjustment Payment Integrity Determination System (RAPIDS),Centers for Medicare & Medicaid Services (CMS),Department of Health and Human Services,HHS,"CLASSIFICATION, AI",RAPIDS AI for Classification| Process Efficiency Improvement,rapids ai process efficiency improvement,4,Service delivery
611,Drug Cost Increase Predictions,Centers for Medicare & Medicaid Services (CMS),Department of Health and Human Services,HHS,,Use Historical drug costs increases to predict future increases,use historical drug costs increases predict future increases,9,"""Asset management"""
612,Brand vs Generic Market Share,Centers for Medicare & Medicaid Services (CMS),Department of Health and Human Services,HHS,,Analyze generic drugs compared to brand drugs over time and forecast future market shares based on Part D claims volume,analyze generic drugs compared brand drugs time forecast future market shares based part claims volume,2,"""Service / benefits access"""
613,Drug cost anomaly detection,Centers for Medicare & Medicaid Services (CMS),Department of Health and Human Services,HHS,,Identify anomalies in drug costs on Part D claims,identify anomalies drug costs part claims,9,"""Program integrity"""
614,Artificial Intelligence (AI) Explorers Program Pilot - Automated Technical Profile,Centers for Medicare & Medicaid Services (CMS),Department of Health and Human Services,HHS,,90 day Pilot is to engage in research and development to investigate applications in the generation of a machine-readable Automated Technical Profile for CMS systems with the goal of inferring the technology fingerprint of CMS projects based on multiple data sources at different stages of their development lifecycle,day pilot engage research development investigate applications generation automated technical profile cms systems goal inferring technology fingerprint cms projects based multiple data sources different stages development lifecycle,19,Asset management
615,Artificial Intelligence (AI) Explorers Program Pilot - Section 508 accessibility Testing,Centers for Medicare & Medicaid Services (CMS),Department of Health and Human Services,HHS,,90 day Pilot is to better inform CMS technical leads and Application Development Organizations (ADOs) to conduct a comprehensive analysis on the data from the test result documents in support of the CMS Section 508 Program.,day pilot better inform cms technical leads application development organizations ados conduct comprehensive analysis data test result documents support cms section program,9,Accessibility
616,Process Large Amount of Submitted Docket Comments,FDA,Department of Health and Human Services,HHS,"AI, ML","Provide an automated process to transfer, deduplicate, summarize and cluster docket comments using AI/ML",provide automated process transfer deduplicate summarize cluster docket comments using,12,Service delivery
617,To develop novel approaches to expand and/or modify the vaccine AESI phenotypes in order to further improve adverse event detection,FDA,Department of Health and Human Services,HHS,ML,Developing a BERT-like ML model to improve detection of adverse events of special interest by applying a clinical-oriented language models pre-trained using the clinical documents from UCSF,developing ml model improve detection adverse events special interest applying language models using clinical documents ucsf,12,Topic: Asset management
618,"BEST Platform improves post-market surveillance efforts through the semi-automated detection, validation and reporting of adverse events.",FDA,Department of Health and Human Services,HHS,"ML, NLP","The BEST Platform employs a suite of applications and techniques to improve the detection, validation and reporting of  biologics-related adverse events from electronic health records (EHRs). The Platform utilizes ML and NLP to detect potential adverse events, and extract the important features for clinicians to validate.  ",best platform employs suite applications techniques improve detection validation reporting adverse events electronic health records ehrs platform utilizes ml nlp detect potential adverse events extract important features clinicians validate,12,Service / benefits access
619,Development of Machine Learning Approaches to Population Pharmacokinetic Model Selection and Evaluation of Application to Model-Based Bioequivalence Analysis,FDA,Department of Health and Human Services,HHS,"REINFORCEMENT LEARNING, DEEP LEARNING","1. Development of a deep learning/reinforcement learning approach to population pharmacokinetic model selections
2. Implementation of an established Genetic algorithm approach to population pharmacokinetic model selections in Python.",development deep learning approach population pharmacokinetic model selections implementation established genetic algorithm approach population pharmacokinetic model selections python,0,"""Asset management"""
620,Machine-Learning based Heterogeneous Treatment Effect Models for Prioritizing Product-Specific Guidance Development,FDA,Department of Health and Human Services,HHS,"MACHINE LEARNING, DATA-DRIVEN","In this project, we propose to develop and implement a novel machine learning algorithm
for estimating heterogeneous treatment effects to prioritize PSG development.
Specifically, we propose three major tasks. First, we will address an important problem in
treatment effect estimation from observational data, where the observed variables may
contain confounders, i.e., variables that affect both the treatment and the outcome. We
will build on recent advances in variational autoencoder to introduce a data-driven method
to simultaneously estimate the hidden confounders and the treatment effect. Second, we
will evaluate our model on both synthetic datasets and previous treatment effect
estimation benchmarks. The ground truth data enable us to investigate model
interpretability. Third, we will validate the model with the real-world PSG data and explain
model output for a particular PSG via collaborating with FDA team. The real-world
datasets are crucial to validate our model, which may include Orange Book, FDAï¿½ï¿½s PSGs,
National Drug Code directory database, Risk Evaluation and Mitigation Strategies
(REMS) data and IQVIA National Sales Perspectives that are publicly available, as well
as internal ANDA submission data.",project propose develop implement novel machine learning algorithm estimating heterogeneous treatment effects prioritize psg development specifically propose three major tasks first address important problem treatment effect estimation observational data observed variables may contain confounders variables affect treatment outcome build recent advances variational autoencoder introduce method simultaneously estimate hidden confounders treatment effect second evaluate model synthetic datasets previous treatment effect estimation benchmarks ground truth data enable us investigate model interpretability third validate model psg data explain model output particular psg via collaborating fda team datasets crucial validate model may include orange book psgs national drug code directory database risk evaluation mitigation strategies rems data iqvia national sales perspectives publicly available well internal anda submission data,9,Topic: People operations
621,Developing Tools based on Text Analysis and Machine Learning to Enhance PSG Review Efficiency,FDA,Department of Health and Human Services,HHS,TEXT SUMMARIZATION,"1. Develop a novel neural summarization model in tandem with information retrieval system, tailored for PSG review, with dual attention over both sentence-level and word-level outputs by taking advantage of both extractive and abstractive summarization.
2. Evaluate the new model with the PSG data and the large CNN/Daily Mail dataset. 
3. Develop an open-source software package for text summarization model and the information retrieval system.",develop novel neural summarization model tandem information retrieval system tailored psg review dual attention outputs taking advantage extractive abstractive summarization evaluate new model psg data large mail dataset develop software package text summarization model information retrieval system,9,"""Asset management"" and ""Internal operations"""
622,BEAM (Bioequivalence Assessment Mate) - a Data/Text Analytics Tool to Enhance Quality and Efficiency of Bioequivalence Assessment,FDA,Department of Health and Human Services,HHS,"MACHINE LEARNING, ARTIFICIAL INTELLIGENCE, AI, ML","We aim to develop BEAM using verified data analytics packages, text mining, and artificial intelligence (AI) toolsets (including machine learning (ML)), to streamline the labor-intensive work during BE assessments to facilitate high-quality and efficient regulatory assessments.
",aim develop beam using verified data analytics packages text mining artificial intelligence ai toolsets including machine learning ml streamline work assessments facilitate efficient regulatory assessments,2,Service / benefits access
623,Application of Statistical Modeling and Natural Language Processing for Adverse Event Analysis,FDA,Department of Health and Human Services,HHS,"NATURAL LANGUAGE PROCESSING, NLP","Drug-induced adverse events (AEs) are difficult to predict for early signal detection, and there is a need to develop new tools and methods to monitor the safety of marketed drugs, including novel approaches for evidence generation. This project will utilize natural language processing (NLP) and data mining (DM) to extract information from approved drug labeling that can be used for statistical modeling to determine when the selected AEs are generally labeled (pre- or post-market) and identify patterns of detection, such as predictive factors, within the first 3 years of marketing of novel drugs. This project is intended to increase our understanding of timing/early detection of AEs, which can be applied to targeted monitoring of novel drugs. Funding will be used to support an ORISE fellow.",adverse events aes difficult predict early signal detection need develop new tools methods monitor safety marketed drugs including novel approaches evidence generation project utilize natural language processing nlp data mining dm extract information approved drug labeling used statistical modeling determine selected aes generally labeled identify patterns detection predictive factors within first years marketing novel drugs project intended increase understanding detection aes applied targeted monitoring novel drugs funding used support orise fellow,11,Topic_name: Program integrity
624,Centers of Excellence in Regulatory Science and Innovation (CERSI) project - Leveraging AI for improving remote interactions.,FDA,Department of Health and Human Services,HHS,SEQ2SEQ,"This project aims to improve four major areas identified by FDA, including transcription, translation, document and evidence management, and co-working space. Automatic speech recognition has been widely used in many applications. Its cutting-edge technology is transformer-based sequence to sequence (seq2seq) model, which is trained to generate transcripts autoregressively and has been fine-tuned on certain datasets. Using pre-trained language models directly may not be suitable because they might not work properly with different accents and specialized regulatory and scientific terminologies. This is because the models were trained on a specific type of data and may not be able to handle data that is significantly different from what they were trained on. To address this, researchers plan to manually read a set of video/audio to obtain their true transcripts, upon which they fine-tune the model to make it adapt to this new domain. Machine translation converts a sequence of text from one language to another. Researchers usually use a method called ""seq2seq,"" where original text is codified into a language that a computer can understand. Then, we use this code to generate the translated version of the text. It's like a translator who listens to someone speak in one language and then repeats what they said in another language. Similarly, it is not appropriate to directly apply the existing pre-trained seq2seq models, because (a) some languages used in the FDA context might not exist in existing models. (b) domain specific terms used in FDA are very different from general human languages. To tackle these challenges, models are trained for some unusual languages and fine-tune pre-trained models for major languages. For both situations, researchers prepare high-quality training set labeled by experts. University of Maryland CERSI (M-CERSI) plans to build a system to manage different documents and evidence, by implementing three sub-systems: (a) document classifier, (b) video/audio classifier, and (c) an interactive middleware that connects the trained model at the backend and the input at the frontend. With this, all documents created during co-working can be shared and accessed by all participants.",project aims improve four major areas identified fda including transcription translation document evidence management space automatic speech recognition widely used many applications technology sequence sequence model trained generate transcripts autoregressively certain datasets using language models directly may suitable might work properly different accents specialized regulatory scientific terminologies models trained specific type data may able handle data significantly different trained address researchers plan manually read set obtain true transcripts upon model make adapt new domain machine translation converts sequence text one language another researchers usually use method called original text codified language computer understand use code generate translated version text like translator listens someone speak one language repeats said another language similarly appropriate directly apply existing models languages used fda context might exist existing models b domain specific terms used fda different general human languages tackle challenges models trained unusual languages models major languages situations researchers prepare training set labeled experts university maryland cersi plans build system manage different documents evidence implementing three document classifier b classifier c interactive middleware connects trained model backend input frontend documents created shared accessed participants,9,Topic 8: Service Delivery
625,Opioid Data Warehouse Term Identification and Novel Synthetic Opioid Detection and Evaluation Analytics,FDA,Department of Health and Human Services,HHS,,"The Term Identification and Novel Synthetic Opioid Detection and Evaluation Analytics use publicly available social media and forensic chemistry data to identify novel referents to drug products in social media text. It uses the FastText library to create vector models of each known NSO-related term in a large social media corpus, and provides users with similarity scores and expected prevalence estimates for lists of terms that could be used to enhance future data gathering efforts. ",term identification novel synthetic opioid detection evaluation analytics use publicly available social media forensic chemistry data identify novel referents drug products social media text uses fasttext library create vector models known term large social media corpus provides users similarity scores expected prevalence estimates lists terms could used enhance future data gathering efforts,9,Service / benefits access
626,Artificial Intelligence-based Deduplication Algorithm for Classification of Duplicate Reports in the FDA Adverse Event Reports (FAERS),FDA,Department of Health and Human Services,HHS,NATURAL LANGUAGE PROCESSING,The deduplication algorithm is applied to nonpublic data in the FDA Adverse Event Reporting System (FAERS) to identify duplicate individual case safety reports (ICSRs). Unstructured data in free text FAERS narratives is processed through a natural language processing system to extract relevant clinical features. Both structured and unstructured data are then used in a probabilistic record linkage approach to identify duplicates. Application of the deduplication algorithm is optimized for processing entire FAERS database to support datamining. ,deduplication algorithm applied nonpublic data fda adverse event reporting system faers identify duplicate individual case safety reports icsrs unstructured data free text faers narratives processed natural language processing system extract relevant clinical features structured unstructured data used probabilistic record linkage approach identify duplicates application deduplication algorithm optimized processing entire faers database support datamining,9,Topic: Asset management
627,Information Visualization Platform (InfoViP) to support analysis of individual case safety reports,FDA,Department of Health and Human Services,HHS,"ARTIFICIAL INTELLIGENCE, VISUALIZATION","Developed the Information Visualization Platform (InfoViP) for post market safety surveillance, to improve the efficiency and scientific rigor of Individual Case Study Reports (ICSRs) review and evaluation process. InfoViP incorporates artificial intelligence and advanced visualizations to detect duplicate ICSRs, create temporal data visualization, and classify ICSRs for useability. ",developed information visualization platform infovip post market safety surveillance improve efficiency scientific rigor individual case study reports icsrs review evaluation process infovip incorporates artificial intelligence advanced visualizations detect duplicate icsrs create temporal data visualization classify icsrs useability,14,Topic: Asset management
628,Using Unsupervised Learning to Generate Code Mapping Algorithms to Harmonize Data Across Data Systems,FDA,Department of Health and Human Services,HHS,,The goal of this project is to assess the potential of dataï¿½ï¿½driven statistical methods for detecting and reducing coding differences between healthcare systems in Sentinel. Findings will inform development and deployment of methods and computational tools for transferring knowledge learned from one site to another and pave the way towards scalable and automated harmonization of electronic health records data.,goal project assess potential statistical methods detecting reducing coding differences healthcare systems sentinel findings inform development deployment methods computational tools transferring knowledge learned one site another pave way towards scalable automated harmonization electronic health records data,2,Internal operations
629,Augmenting date and cause of death ascertainment in observational data sources,FDA,Department of Health and Human Services,HHS,,"The objective of this project is to develop a set of algorithms to augment assessment of mortality through probabilistic linkage of alternative data sources with EHRs. Development of generalizable approaches to improve death ascertainment is critical to improve validity of Sentinel investigations using mortality as an endpoint, and these algorithms may also be usable in supplementing death ascertainment in claims data as well. Specifically, we propose the following Aims.
Specific Aim 1: We propose to leverage online publicly available data to detect date of death for patients seen at two healthcare systems.
Specific Aim 2: We propose to augment cause of death data using healthcare system narrative text and administrative codes to develop probabilistic estimates for common causes of death",objective project develop set algorithms augment assessment mortality probabilistic linkage alternative data sources ehrs development generalizable approaches improve death ascertainment critical improve validity sentinel investigations using mortality endpoint algorithms may also usable supplementing death ascertainment claims data well specifically propose following aims specific aim propose leverage online publicly available data detect date death patients seen two healthcare systems specific aim propose augment cause death data using healthcare system narrative text administrative codes develop probabilistic estimates common causes death,2,Service delivery
630,Scalable automated NLP-assisted chart abstraction and feature extraction tool,FDA,Department of Health and Human Services,HHS,NLP,"The overall goal of this study is to demonstrate the usability and value of currently available data sources and techniques in electronic medical records by harnessing claims and EHR data, including structured, semi-structured, and unstructured data, in a pharmacoepidemiology study. This study will use real-world longitudinal data from the Cerner Enviza Electronic Health Records (CE EHR) linked to claims with NLP technology applied to physician notes. NLP methods will be used to identify and contextualize pre-exposure confounding variables, incorporate unstructured EHR data into confounding adjustment, and for outcome ascertainment. Use case study; This study will seek to understand the relationship between use of montelukast among patients with asthma and neuropsychiatric events.",overall goal study demonstrate usability value currently available data sources techniques electronic medical records harnessing claims ehr data including structured unstructured data pharmacoepidemiology study study use longitudinal data cerner enviza electronic health records ce ehr linked claims nlp technology applied physician notes nlp methods used identify contextualize confounding variables incorporate unstructured ehr data confounding adjustment outcome ascertainment use case study study seek understand relationship use montelukast among patients asthma neuropsychiatric events,7,Internal operations
