,Title,Agency,Department,Department_code,Techniques,Summary,Processed_Summary,Cluster,topics
657,Towards Explainable AI: Advancing Predictive Modeling for Regulatory Use,FDA,Department of Health and Human Services,HHS,"ARTIFICIAL INTELLIGENCE, AI, DECISION MAKING","Artificial Intelligence (AI) is a broad discipline of training machines to think and accomplish complex intellectual tasks like humans. It learns from existing data/information to predict future outcomes, distill knowledge, offer advices, or plan action steps. The rise of AI has offered both opportunities and challenges to FDA in two aspects: (1) how to assess and evaluate marketed AI-centric products and (2) how to implement AI methods to improve the agency's operation. One of the key aspects of both regulatory applications is to understand the underlying features driving the AI performance and to the extension of its interpretability in the context of application.  
 
Different from the statistical evaluation (e.g., accuracy, sensitivity and specificity), model interpretability assessment lacks quantitative metrics. In most cases, the assessment tends to be subjective, where prior knowledge is often used as a ground-truth to explain the biological relevance of underlying features, e.g., whether the biomarkers featured by the model are in accordance with the existing findings. In reality, there is a trade-off between statistical performance and interpretability among different AI algorithms, and understanding the difference will improve the context of use of AI technologies in regulatory science.  

For that, we will investigate representative AI methods, in terms of their performance and interpretability, first through benchmark datasets that have been well-established in the research community, then extended to clinical/pre-clinical datasets. This project will provide basic parameters and offer an insightful guidance on developing explainable AI models to facilitate the real-world decision making in regulatory settings.",artificial intelligence ai broad discipline training machines think accomplish complex intellectual tasks like humans learns existing predict future outcomes distill knowledge offer advices plan action steps rise ai offered opportunities challenges fda two aspects assess evaluate marketed products implement ai methods improve agency operation one key aspects regulatory applications understand underlying features driving ai performance extension interpretability context application different statistical evaluation accuracy sensitivity specificity model interpretability assessment lacks quantitative metrics cases assessment tends subjective prior knowledge often used explain biological relevance underlying features whether biomarkers featured model accordance existing findings reality statistical performance interpretability among different ai algorithms understanding difference improve context use ai technologies regulatory science investigate representative ai methods terms performance interpretability first benchmark datasets research community extended datasets project provide basic parameters offer insightful guidance developing explainable ai models facilitate decision making regulatory settings,9,Policy-making and public engagement
658,Identification of sex differences on prescription opioid use (POU)-related cardiovascular risks by big data analysis,FDA,Department of Health and Human Services,HHS,"BIG DATA, AI","1) Prescription opioid use (POU) varies among patient population subgroups, such as gender, age, and ethnicity. POU can potentially cause various adverse effects in the respiratory, gastrointestinal, musculoskeletal, cardiovascular, immune, endocrine, and central nervous systems. Important sex differences have been observed in POU-associated cardiac endpoints. Currently, systematic knowledge is lacking for risk factors associated with the increased cardiotoxicity of POU in women. 2) Currently, the FDA utilizes two methods of analysis for data mining, the Proportional Reporting Ratio (PRR) and the Empirical Bayesian Geometric Mean (EBGM) to identify significant statistical associations between products and adverse events (AEs). These methods are not applicable when two or more reporting measures (e.g. gender, age, race, etc.) must be considered and compared. In this study, a novel statistical model will be developed to detect the safety signals when gender is considered as the third variable. Safety signals will then be detected and compared from combined multiple-layered real-world evidence in the form of EHRs from diverse sources. Sex-dependent differences in risk factors for cardiotoxicity from POU will be identified and analyzed using big data methods and AI-related tools. 3) The proposed project addresses the first of four priority areas of FDA's 2018 Strategic Policy Roadmap: Reduce the burden of addiction crises that are threatening American families, and two priority areas of Women's Health Research Roadmap: Priority Area 1: Advance Safety and Efficacy, and Priority Area 5: Expand Data Sources and Analysis. The results may provide information and knowledge to help the FDA drug reviewers and physicians be aware of sex differences to certain POU drugs and combinations of POU with other prescription drugs, therefore, preventing or reducing risk of the POU drug-induced CVD in women.",prescription opioid use pou varies among patient population subgroups gender age ethnicity pou potentially cause various adverse effects respiratory gastrointestinal musculoskeletal cardiovascular immune endocrine central nervous systems important sex differences observed cardiac endpoints currently systematic knowledge lacking risk factors associated increased cardiotoxicity pou women currently fda utilizes two methods analysis data mining proportional reporting ratio prr empirical bayesian geometric mean ebgm identify significant statistical associations products adverse events aes methods applicable two reporting measures gender age race etc must considered compared study novel statistical model developed detect safety signals gender considered third variable safety signals detected compared combined evidence form ehrs diverse sources differences risk factors cardiotoxicity pou identified analyzed using big data methods tools proposed project addresses first four priority areas fda strategic policy roadmap reduce burden addiction crises threatening american families two priority areas women health research roadmap priority area advance safety efficacy priority area expand data sources analysis results may provide information knowledge help fda drug reviewers physicians aware sex differences certain pou drugs combinations pou prescription drugs therefore preventing reducing risk pou cvd women,9,11. Other
659,NCTR/DBB-CDER/OCS collaboration on A SafetAI Initiative to Enhance IND Review Process,FDA,Department of Health and Human Services,HHS,"MACHINE LEARNING, ARTIFICIAL INTELLIGENCE, NEURAL NETWORKS, AI, ML, DL, DEEP LEARNING","The development of animal-free models has been actively investigated and successfully demonstrated as an alternative to animal-based approaches for toxicity assessments.  Artificial Intelligence (AI) and Machine learning (ML) have been the central engine in this paradigm shift to identify safety biomarkers from non-animal assays or to predict safety outcomes solely based on chemical structure data. AI is a computer system or algorithm that has the ability to learn from existing data to foresee the future outcome. ML, a subset of AI, has been specifically studied to make predictions for adverse drug reactions. Deep Learning (DL) is arguably the most advanced approach in ML which frequently outperforms other types of ML approaches (or conventional ML approaches) for the study of drug safety and efficacy. DL usually consists of multiple layers of neural networks to mimic the cognitive behaviors associated with the human brain learning and problem-solving process to solve data intensive problems. Among many studies using AI/ML, DL has become a default algorithm to consider due to its superior performance. This proposal will apply DL to flag safety concerns regarding drug-induced liver injury (DILI) and carcinogenicity during the IND review process.",development models actively investigated successfully demonstrated alternative approaches toxicity assessments artificial intelligence ai machine learning ml central engine paradigm shift identify safety biomarkers assays predict safety outcomes solely based chemical structure data ai computer system algorithm ability learn existing data foresee future outcome ml subset ai specifically studied make predictions adverse drug reactions deep learning dl arguably advanced approach ml frequently outperforms types ml approaches conventional ml approaches study drug safety efficacy dl usually consists multiple layers neural networks mimic cognitive behaviors associated human brain learning process solve data intensive problems among many studies using dl become default algorithm consider due superior performance proposal apply dl flag safety concerns regarding liver injury dili carcinogenicity ind review process,9,Topic: Asset management
660,individual Functional Activity Composite Tool (inFACT),NIH,Department of Health and Human Services,HHS,,inFACT is being developed for use in the Social Security Administration (SSA) disability determination process to assist adjudicators in identifying evidence on function from case records that might be hundreds or thousands of pages long. inFACT displays information on whole person function as extracted from an individual's free text medical records and aligned with key business elements.,infact developed use social security administration ssa disability determination process assist adjudicators identifying evidence function case records might hundreds thousands pages long infact displays information whole person function extracted individual free text medical records aligned key business elements,6,Service / benefits access
661,Assisted Referral Tool,NIH,Department of Health and Human Services,HHS,,To provide assistance in assigning appropriate scientific areas for grant applications.,provide assistance assigning appropriate scientific areas grant applications,14,"""Service / benefits access"""
662,NanCI: Connecting Scientists,NIH,Department of Health and Human Services,HHS,AI,"Uses AI to match scientific content to users interests. By collecting papers into a folder a user can engage the tool to find similar articles in the scientific literature, and can refine the recommendations by up or down voting of recommendations. Users can also connect with others via their interests, and receive and make recommendations via this social network.",uses ai match scientific content users interests collecting papers folder user engage tool find similar articles scientific literature refine recommendations voting recommendations users also connect others via interests receive make recommendations via social network,6,"""Service delivery"""
663,Detection of Implementation Science focus within incoming grant applications,NIH,Department of Health and Human Services,HHS,"MACHINE LEARNING, NATURAL LANGUAGE PROCESSING","This tool uses natural language processing and machine learning to calculate an Implementation Science (IS) score that is used to predict if a newly submitted grant application proposes to use science that can be categorized as ""Implementation Science"" (a relatively new area of delineation). NHLBI uses the ""IS score"" in its decision for assigning the application to a particular division for routine grants management oversight and administration.",tool uses natural language processing machine learning calculate implementation science score used predict newly submitted grant application proposes use science categorized implementation science relatively new area delineation nhlbi uses score decision assigning application particular division routine grants management oversight administration,14,Topic: Policy-making and public engagement
664,Federal IT Acquisition Reform Act (FITARA) Tool,NIH,Department of Health and Human Services,HHS,,The tool automates the identification of NIAID contracts that are IT-related.,tool automates identification niaid contracts,9,"""Asset management"""
665,"Division of Allergy, Immunology, and Transplantation (DAIT) AIDS-Related Research Solution",NIH,Department of Health and Human Services,HHS,"NATURAL LANGUAGE PROCESSING, CLASSIFICATION, NLP","The tool uses natural language processing (NLP), text extraction, and classification algorithms to predict both high/medium/low priority and area of research for a grant application. The incoming grant applications are ranked based on these predictions and more highly-ranked applications are prioritized for review.",tool uses natural language processing nlp text extraction classification algorithms predict priority area research grant application incoming grant applications ranked based predictions applications prioritized review,9,Topic: Service Delivery
666,Scientific Research Data Management System Natural Language Processing Conflict of Interest Tool,NIH,Department of Health and Human Services,HHS,NLP,"A tool that identifies entities within a grant application to allow NIAID's Scientific Review Program team to more easily identify conflicts of interest (COI) between grant reviewers and applicants using NLP methods (e.g., OCR, text extraction).",tool identifies entities within grant application allow niaid scientific review program team easily identify conflicts interest coi grant reviewers applicants using nlp methods ocr text extraction,14,"""Service / benefits access"""
667,Tuberculosis (TB) Case Browser Image Text Detection,NIH,Department of Health and Human Services,HHS,,A tool to detect text in images that could be potentially Personally Identifiable Information (PII)/ Protected Health Information (PHI) in TB Portals.,tool detect text images could potentially personally identifiable information pii protected health information phi tb portals,6,Service delivery
668,Research Area Tracking Tool,NIH,Department of Health and Human Services,HHS,MACHINE LEARNING,A dashboard that incorporates machine learning to help identify projects within certain high-priority research areas.,dashboard incorporates machine learning help identify projects within certain research areas,7,Service delivery
669,NIDCR Digital Transformation Initiative (DTI),NIH,Department of Health and Human Services,HHS,"NATURAL LANGUAGE PROCESSING, CHATBOT","An initiative to create a natural language processing chatbot to improve efficiency, transparency, and consistency for NIDCR employees. ",initiative create natural language processing chatbot improve efficiency transparency consistency nidcr employees,4,Service delivery
670,NIDCR Data Bank,NIH,Department of Health and Human Services,HHS,"AI, ML, NLP","The project will permit intramural research program investigators to move large sets of unstructured data into a cloud archival storage, which will scale, provide cost effective data tiering, capture robust meta data sufficient for management and governance, and create secondary or tertiary opportunities for analysis leveraging cognitive services AI/ML/NLP toolsets.",project permit intramural research program investigators move large sets unstructured data cloud archival storage scale provide cost effective data tiering capture robust meta data sufficient management governance create secondary tertiary opportunities analysis leveraging cognitive services toolsets,2,"""Asset management"""
671,Automated approaches for table extraction,NIH,Department of Health and Human Services,HHS,,"This project developed an automated, model-based processes to reduce the time and level of effort for manualï¿½extraction of data from tables. Published data tables are a particularly data-rich and challenging presentation of critical information in published research.",project developed automated processes reduce time level effort data tables published data tables particularly challenging presentation critical information published research,14,"""Asset management"""
672,SWIFT Active Screener,NIH,Department of Health and Human Services,HHS,,Applies statistical models designed to save screeners time and effort through active learning. Utilize user feedback to automatically prioritize studies. Supports literature screening for Division of Translational Toxicology evidence evaluations.,applies statistical models designed save screeners time effort active learning utilize user feedback automatically prioritize studies supports literature screening division translational toxicology evidence evaluations,3,Topic: Accessibility
673,Splunk IT System Monitoring Software,NIH,Department of Health and Human Services,HHS,MACHINE LEARNING,Utilizes machine learning to aggregate system logs from on-premises IT infrastructure systems and endpoints for auditing and cybersecurity monitoring purposes.,utilizes machine learning aggregate system logs infrastructure systems endpoints auditing cybersecurity monitoring purposes,10,Internal operations
674,Clinical Trial Predictor,NIH,Department of Health and Human Services,HHS,"MACHINE LEARNING, NATURAL LANGUAGE PROCESSING","The Clinical Trial Predictor uses an ensemble of several natural language processing and machine learning algorithms to predict whether applications may involve clinical trials based on the  text of their titles, abstracts, narratives, specific aims, and research strategies.",clinical trial predictor uses ensemble several natural language processing machine learning algorithms predict whether applications may involve clinical trials based text titles abstracts narratives specific aims research strategies,9,Service delivery: use of AI to provide direct services either to the public or to state/local/tribal/territorial governments
675,Stem Cell Auto Coder,NIH,Department of Health and Human Services,HHS,"MACHINE LEARNING, NATURAL LANGUAGE PROCESSING","The Stem Cell Auto Coder uses natural language processing and machine learning to predict the Stem Cell Research subcategories of an application: human embryonic, non-human embryonic, human induced pluripotent, non-human induced pluripotent, human non-embryonic, and non-human non-embryonic.",stem cell auto coder uses natural language processing machine learning predict stem cell research subcategories application human embryonic embryonic human induced pluripotent induced pluripotent human,11,Service delivery
676,JIT Automated Calculator (JAC),NIH,Department of Health and Human Services,HHS,NATURAL LANGUAGE PROCESSING,The JIT Automated Calculator (JAC) uses natural language processing to parse Just-In-Time (JIT) Other Support forms and determine how much outside support PIs are receiving from sources other than the pending application.,jit automated calculator jac uses natural language processing parse jit support forms determine much outside support pis receiving sources pending application,19,Service delivery
677,Similarity-based Application and Investigator Matching (SAIM),NIH,Department of Health and Human Services,HHS,NATURAL LANGUAGE PROCESSING,The SAIM system uses natural language processing to identify non-NIH grants awarded to NIGMS Principal Investigators. The system aids in identifying whether a grant application has significant unnecessary overlap with one funded by another agency.,saim system uses natural language processing identify grants awarded nigms principal investigators system aids identifying whether grant application significant unnecessary overlap one funded another agency,14,Topic: Service / benefits access
678,Remediate Adobe .pdf documents to be more accessible,NIH,Department of Health and Human Services,HHS,AI,Many .pdf documents could be made available for public release if they conformed to Section 508 accessibility standards. NLM has been investigating the use of AI developed to remediate Adobe .pdf files not currently accessible to Section 508 standards.ï¿½The improved files are particularly more accessible to those like the blind who use assistive technology to read.,many documents could made available public release conformed section accessibility standards nlm investigating use ai developed remediate adobe files currently accessible section improved files particularly accessible like blind use assistive technology read,9,Accessibility
679,CylanceProtect,NIH,Department of Health and Human Services,HHS,CYBERTHREATS,Protection of Windows and Mac endpoints from Cyberthreats,protection windows mac endpoints cyberthreats,3,Service delivery
680,MEDIQA: Biomedical Question Answering,NIH,Department of Health and Human Services,HHS,"MACHINE LEARNING, AI",Using and developing AI approaches to automate question answering for different users. This project leverages NLM knowledge sources and traditional and neural machine learning to address a wide-range of biomedical information needs. This project aims for improving access with one-entry access point to NLM resources.,using developing ai approaches automate question answering different users project leverages nlm knowledge sources traditional neural machine learning address biomedical information needs project aims improving access access point nlm resources,2,Service delivery
681,CLARIN: Detecting clinicians' attitudes through clinical notes,NIH,Department of Health and Human Services,HHS,AI,"Understanding clinical notes and detecting bias is essential in supporting equity and diversity, as well as quality of care and decision support. NLM is using and developing AI approaches to detect clinicians' emotions, biases and burnout.",understanding clinical notes detecting bias essential supporting equity diversity well quality care decision support nlm using developing ai approaches detect clinicians emotions biases burnout,11,"""Program integrity"""
682,Best Match: New relevance search for PubMed,NIH,Department of Health and Human Services,HHS,MACHINE-LEARNING,"PubMed is a free search engine for biomedical literature accessed by millions of users from around the world each day. With the rapid growth of biomedical literature, finding and retrieving the most relevant papers for a given query is increasingly challenging. NLM developed Best Match, a new relevance search algorithm for PubMed that leverages the intelligence of our users and cutting-edge machine-learning technology as an alternative to the traditional date sort order. ",pubmed free search engine biomedical literature accessed millions users around world day rapid growth biomedical literature finding retrieving relevant papers given query increasingly challenging nlm developed best match new relevance search algorithm pubmed leverages intelligence users technology alternative traditional date sort order,6,Internal operations
683,SingleCite: Improving single citation search in PubMed,NIH,Department of Health and Human Services,HHS,REGRESSION,"A search that is targeted at finding a specific document in databases is called a Single Citation search, which is particularly important for scholarly databases, such as PubMed, because it is a typical information need of the users. NLM developed SingleCite, an automated algorithm that establishes a query-document mapping by building a regression function to predict the probability of a retrieved document being the target based on three variables: the score of the highest scoring retrieved document, the difference in score between the two top retrieved documents, and the fraction of a query matched by the candidate citation. SingleCite shows superior performance in benchmarking experiments and is applied to rescue queries that would fail otherwise.",search targeted finding specific document databases called single citation search particularly important scholarly databases pubmed typical information need users nlm developed singlecite automated algorithm establishes mapping building regression function predict probability retrieved document target based three variables score highest scoring retrieved document difference score two top retrieved documents fraction query matched candidate citation singlecite shows superior performance benchmarking experiments applied rescue queries would fail otherwise,6,Topic: Other
684,Computed Author: author name disambiguation for PubMed,NIH,Department of Health and Human Services,HHS,"CLUSTERING, MACHINE-LEARNING","PubMed users frequently use author names in queries for retrieving scientific literature. However, author name ambiguity (different authors share the same name) may lead to irrelevant retrieval results. NLM developed a machine-learning method to score the features for disambiguating a pair of papers with ambiguous names. Subsequently, agglomerative clustering is employed to collect all papers belong to the same authors from those classified pairs. Disambiguation performance is evaluated with manual verification of random samples of pairs from clustering results, with a higher accuracy than other state-of-the-art methods. It has been integrated into PubMed to facilitate author name searches.",pubmed users frequently use author names queries retrieving scientific literature however author name ambiguity different authors share name may lead irrelevant retrieval results nlm developed method score features disambiguating pair papers ambiguous names subsequently agglomerative clustering employed collect papers belong authors classified pairs disambiguation performance evaluated manual verification random samples pairs clustering results higher accuracy methods integrated pubmed facilitate author name searches,14,Topic: 10. Internal operations
