,Title,Agency,Department,Department_code,Techniques,Summary,Processed_Summary,Cluster,topics
363,To employ machine learning to study the dependence of electrochemical performance on microstructural details,National Energy Technology Laboratory,Department of Energy,DOE,"ARTIFICIAL INTELLIGENCE, NEURAL NETWORKS","With a significant number of images. The Recipient will build deep 
learning methods at the object detection stage using the Region Based 
Convolutional Neural Network (RCNN) or You Only Look Once (YOLO) 
class of algorithms, the heart of which is a deep learning image 
classifier. Deep learning algorithms will also be built using convolutional 
layers followed by residual layers to extract feature vector descriptors in 
the second stage. In the third and fourth stages of affinity and 
association, a recurrent neural network approach can be used to build a 
tracker. All of these approaches require a large training set that will 
enable sophisticated models to be built to handle the complexity of the 
application.
With a limited number of images. In the case that there is are a limited 
number of images, the Recipient will still be able to follow the processing 
pipeline. The recipient will determine a suitable approach, with 
concurrence from the project manager. Two potential approaches 
include:
â¢ Transfer learning: training the image classifier in the object detector on 
images of similar quality and appearance, and 
â¢ Match filtering: detection, feature extraction, and matching based on 
traditional image processing and computer vision techniques.",significant number images recipient build deep learning methods object detection stage using region based convolutional neural network rcnn look yolo class algorithms heart deep learning image classifier deep learning algorithms also built using convolutional layers followed residual layers extract feature vector descriptors second stage third fourth stages affinity association recurrent neural network approach used build tracker approaches require large training set enable sophisticated models built handle complexity application limited number images case limited number images recipient still able follow processing pipeline recipient determine suitable approach concurrence project manager two potential approaches include transfer learning training image classifier object detector images similar quality appearance match filtering detection feature extraction matching based traditional image processing computer vision techniques,11,Topic: Asset management
364,To enhance the SimCCS toolset to better account for existent infrastructure and to more broadly engage other user bases to improve toolset performance and applicability.,National Energy Technology Laboratory,Department of Energy,DOE,ARTIFICIAL INTELLIGENCE UNKNOWN,"Continue development of the SimCCS toolset, which is utilized to 
determine optimal placement for CO2 pipeline rights of way (ROW) and 
infrastructure in a machine-learning driven methodology that that 
considers environmentally sensitive areas, Justice40 considerations, 
and utilization of existent infrastructure.",continue development simccs toolset utilized determine optimal placement pipeline rights way row infrastructure driven methodology considers environmentally sensitive areas considerations utilization existent infrastructure,5,Asset management
365,To evaluate current infrastructure throughout a study area and evaluating future infrastructure needs to accelerate the deployment of CCUS,National Energy Technology Laboratory,Department of Energy,DOE,ARTIFICIAL INTELLIGENCE UNKNOWN,"One key task focuses on evaluating current infrastructure throughout the 
Initiative study area and evaluating future infrastructure needs to 
accelerate the deployment of CCUS. LANL will utilize its unique 
technologies for this project focusing on SimCCS, with a minor 
consulting role using NRAP and machine learning algorithms.",one key task focuses evaluating current infrastructure throughout initiative study area evaluating future infrastructure needs accelerate deployment ccus lanl utilize unique technologies project focusing simccs minor consulting role using nrap machine learning algorithms,16,Asset management
366,To expore and analtze hydrogen- fueled rotating detonation engines using advanced turbulent combustion modeling and high- fidelity simultion tools.,National Energy Technology Laboratory,Department of Energy,DOE,ARTIFICIAL INTELLIGENCE UNKNOWN,"(1) analysis of injector design effects on RDE parasitic combustion; (2) 
understanding the impact of RDE ignition mechanism and initial 
transients on the ensuing detonation wave behavior; (3) deployment and 
assessment of machine learning assisted turbulent combustion models 
for predictive and computationally-efficient RDE CFD simulations; and 
(4) development of a highly scalable high-order CFD modeling 
framework for scale-resolving simulations of full-scale RDEs and 
investigation of TCI and wall boundary layer effects.(1) analysis of 
injector design effects on RDE parasitic combustion; (2) understanding 
the impact of RDE ignition mechanism and initial transients on the 
ensuing detonation wave behavior; (3) deployment and assessment of 
machine learning assisted turbulent combustion models for predictive 
and computationally-efficient RDE CFD simulations; and (4) 
development of a highly scalable high-order CFD modeling framework 
for scale-resolving simulations of full-scale RDEs and investigation of 
TCI and wall boundary layer effects.",analysis injector design effects rde parasitic combustion understanding impact rde ignition mechanism initial transients ensuing detonation wave behavior deployment assessment machine learning assisted turbulent combustion models predictive rde cfd simulations development highly scalable cfd modeling framework simulations rdes investigation tci wall boundary layer effects analysis injector design effects rde parasitic combustion understanding impact rde ignition mechanism initial transients ensuing detonation wave behavior deployment assessment machine learning assisted turbulent combustion models predictive rde cfd simulations development highly scalable cfd modeling framework simulations rdes investigation tci wall boundary layer effects,17,Topic: 11. Other
367,To fill critical data gaps in big data analytics and machine learning applications to inform decision making and improve the ultimate recovery of unconventional oil and natural gas resources.,National Energy Technology Laboratory,Department of Energy,DOE,"ARTIFICIAL INTELLIGENCE, BIG DATA","Project will conduct numerical analysis of all-digital pressure sensing 
technology will be used to create a synthetic dataset with downhole 
pressure sensor readings for each stage and will be analyzed 
statistically with DA to integrate with software.",project conduct numerical analysis pressure sensing technology used create synthetic dataset downhole pressure sensor readings stage analyzed statistically da integrate software,15,Asset management
368,"To help automate data discovery and preparations to support a range of CS models, tools, and products",National Energy Technology Laboratory,Department of Energy,DOE,"BIG DATA, NATURAL LANGUAGE PROCESSING, OTHER","AI & ML are used to help collect and process data from multipel sources 
to further integrate and characterize infromation to provide additional 
data and infromation to support a range of carbon storage work",ai ml used help collect process data multipel sources integrate characterize infromation provide additional data infromation support range carbon storage work,15,Service delivery
369,To help automate data integration and exploration for geologic core properties related information.,National Energy Technology Laboratory,Department of Energy,DOE,"BIG DATA, NATURAL LANGUAGE PROCESSING, OTHER","Using natural language processing, deep learning neural networks, and 
possibly tensor flow for image analytics.",using natural language processing deep learning neural networks possibly tensor flow image analytics,12,Service / benefits access
370,To identify and characterization REE- CM hot zones using machine learning-aided multi-physics.,National Energy Technology Laboratory,Department of Energy,DOE,ARTIFICIAL INTELLIGENCE UNKNOWN,"Develop and field demonstrate a machine learning (ML)-aided multi-
physics approach for rapid identification and characterization of REE-
CM hot zones in mine tailings with a focus on coal and sulfide mine 
tailings or other processing or utilization byproducts, such as fly ash and 
refuse deposits.",develop field demonstrate machine learning ml physics approach rapid identification characterization cm hot zones mine tailings focus coal sulfide mine tailings processing utilization byproducts fly ash refuse deposits,7,Asset management
371,To implement boiler health monitoring using a hybrid first principles-artificial intelligence model,National Energy Technology Laboratory,Department of Energy,DOE,ARTIFICIAL INTELLIGENCE UNKNOWN,"Develop methodologies and algorithms to yield (1) a hybrid first-
principles artificial intelligence (AI) model of a PC boiler, (2) a physics-
based approach to material damage informed by ex-service component 
evaluation, and (3) an online health-monitoring framework that 
synergistically leverages the hybrid models and plant measurements to 
provide the spatial and temporal profile of key transport variables and 
characteristic measures for plant health.",develop methodologies algorithms yield hybrid principles artificial intelligence ai model pc boiler based approach material damage informed component evaluation online framework synergistically leverages hybrid models plant measurements provide spatial temporal profile key transport variables characteristic measures plant health,3,Topic: Asset management
372,To implement machine learning to predict aerodynamic and combustion characteristics in hydrogen turbine,National Energy Technology Laboratory,Department of Energy,DOE,ARTIFICIAL INTELLIGENCE UNKNOWN,"Design rules and reduced models will be formulated by combining high 
fidelity simulations of chemically reacting flow, stochastic modeling 
techniques, reduced modeling through machine learning and testing of 
injector configurations. These can be used in an industrial setting to 
predict the aerodynamic and combustion characteristics in hydrogen 
turbine combustors based upon which design decisions are made.",design rules reduced models formulated combining high fidelity simulations chemically reacting flow stochastic modeling techniques reduced modeling machine learning testing injector configurations used industrial setting predict aerodynamic combustion characteristics hydrogen turbine combustors based upon design decisions made,0,Asset management
373,To implement novel SSC-CCS sensing technology and associated condition-based monitoring (CBM) software for improved understanding of the boiler tube failure mechanisms,National Energy Technology Laboratory,Department of Energy,DOE,,"A preliminary condition-based monitoring (CBM) package with graphic 
user interface (GUI) will be developed. This CUI will allow the operators 
to view the current and historical signals of temperature profiles of the 
boiler tube at specific sensor locations. Combining the pre-existing 
conditions and the opinions from designers/operators/expertsâ 
experiences, the system will be integrated with EPRIâs Boiler Failure 
Reduction Program to provide assessments on the health conditions of 
the boiler tubes, warnings/diagnoses on potential failures and locations, 
and suggestions on maintenance locations and schedules.",preliminary monitoring cbm package graphic user interface gui developed cui allow operators view current historical signals temperature profiles boiler tube specific sensor locations combining conditions opinions experiences system integrated boiler failure reduction program provide assessments health conditions boiler tubes potential failures locations suggestions maintenance locations schedules,19,Asset management
374,To implement sensor-driven deep learning/artificial intelligence for power plant monitoring,National Energy Technology Laboratory,Department of Energy,DOE,"ARTIFICIAL INTELLIGENCE, NEURAL NETWORKS","Sensor-driven deep learning/artificial intelligence for intelligent health 
monitoring capabilities that occur at the sensor (embedded computing) 
or base station (edge computing). Will give power plant operators more 
prediction tools about scheduling maintenance. Focus is on a high-
priority in-situ boiler temperature measurement system that relies on 
chipless RFID technology and much-needed temperature, pressure, 
environmental, and water quality industrial sensors.",deep intelligence intelligent health monitoring capabilities occur sensor embedded computing base station edge computing give power plant operators prediction tools scheduling maintenance focus priority boiler temperature measurement system relies chipless rfid technology temperature pressure environmental water quality industrial sensors,19,Service delivery:
375,To implement unsupervised learning based interaction force model for nonspherical particles in incompressible flows,National Energy Technology Laboratory,Department of Energy,DOE,"ARTIFICIAL INTELLIGENCE, NEURAL NETWORKS","Develop a neural network-based interaction (drag and lifting) force 
model. A database will be constructed of the interaction force between 
the non-spherical particles and the fluid phase based on the particle-
resolved direct numerical simulation (PR-DNS) with immersed boundary-
based lattice Boltzmann method (IB-LBM). An unsupervised learning 
method, i.e., variational auto-encoder (VAE), will be used to improve the 
diversity of the non-spherical particle library and to extract the primitive 
shape factors determining the drag and lifting forces. The interaction 
force model will be trained and validated with a simple but effective multi-
layer feed-forward neural network: multi-layer perceptron (MLP), which 
will be concatenated after the encoder of the previously trained VAE for 
geometry feature extraction.",develop neural interaction drag lifting force model database constructed interaction force particles fluid phase based resolved direct numerical simulation immersed based lattice boltzmann method unsupervised learning method variational vae used improve diversity particle library extract primitive shape factors determining drag lifting forces interaction force model trained validated simple effective layer neural network perceptron mlp concatenated encoder previously trained vae geometry feature extraction,5,Asset management
376,To improve control of hybrid SOFC- gas turbine power systems.,National Energy Technology Laboratory,Department of Energy,DOE,OTHER,"Machine learning algorithms are being developed and compared to 
other control methods for SOFC-gas turbine hybrid  power generation 
systems.",machine learning algorithms developed compared control methods turbine hybrid power generation systems,19,Service delivery
377,"To leverage disparate data to update assessments, analytics, and infromation for NATCARB and CS Atlas",National Energy Technology Laboratory,Department of Energy,DOE,OTHER,"ML Is utilized to parse and generate additional data and information that 
can be parsed and labeled to provide additional inputs for geologic 
carbon storgae assessments from multiple sources.",ml utilized parse generate additional data information parsed labeled provide additional inputs geologic carbon storgae assessments multiple sources,14,Topic: Asset management
378,To leverage machine learning and predictive analytics to advance the state of the art in pipline infrastructure integrity management.,National Energy Technology Laboratory,Department of Energy,DOE,ARTIFICIAL INTELLIGENCE UNKNOWN,"The purpose of this project is to leverage advances in machine learning 
and predictive analytics to advance the state of the art in pipeline 
infrastructure integrity management using forecasted (predicted) 
pipeline condition, using large sets of pipeline integrity data (periodic 
nondestructive inspection, NDI) and continuous operational data (e.g., 
sensor data used to monitor flow rate and temperature) generated by oil 
and gas (O&G) transmission pipeline operators.",purpose project leverage advances machine learning predictive analytics advance state art pipeline infrastructure integrity management using forecasted predicted pipeline condition using large sets pipeline integrity data periodic nondestructive inspection ndi continuous operational data sensor data used monitor flow rate temperature generated oil gas g transmission pipeline operators,15,Asset management
379,To leverage ML models to increase the size and complexity of problems that can be optimized within IDAES.,National Energy Technology Laboratory,Department of Energy,DOE,OTHER,"The objective is to leverage ML models as surrogates for complex unit 
operations or to bridge between scales to increase the size and 
complexity of models that can be optimized within IDAES.",objective leverage ml models surrogates complex unit operations bridge scales increase size complexity models optimized within idaes,0,Topic: Asset management
380,To perform reconstruction of the 3D temperature field using Neural Networks with measured and known propagation paths.,National Energy Technology Laboratory,Department of Energy,DOE,ARTIFICIAL INTELLIGENCE UNKNOWN,"The sensor will first be tested up to 300 ï°C. For high-temperature tests, 
the Recipient will use Alstomâs Industrial Size Burner Test Facility (ISBF) 
or another appropriate facility. The high-temperature sensor will be first 
tested from room temperature to 1,800 ï°C. The results will be 
compared with data obtained using other methods such as surface 
acoustic wave (SAW), thermocouples, and optical fiber sensors. A 3D 
temperature mapping will be created by fusing the high-temperature 
sensor data. The Recipient will test the systemâs survivability in a boiler 
environment. A high-temperature sensing array will be tested to map the 
temperature distribution within an exhaust pipe. The sensor array will be 
tested at one 6ââ port or a similar location. The Recipient will also 
perform reconstruction of the 3D temperature field using Neural 
Networks with measured and known propagation paths.",sensor first tested tests recipient use industrial size burner test facility isbf another appropriate facility sensor first tested room temperature results compared data obtained using methods surface acoustic wave saw thermocouples optical fiber sensors temperature mapping created fusing sensor data recipient test survivability boiler environment sensing array tested map temperature distribution within exhaust pipe sensor array tested one port similar location recipient also perform reconstruction temperature field using neural networks measured known propagation paths,15,Asset management: use of AI to manage both physical and digital assets
381,To provide an effective quality assurance method for additively manufactured gas,National Energy Technology Laboratory,Department of Energy,DOE,ARTIFICIAL INTELLIGENCE UNKNOWN,"The primary goal of this project is to develop a cost-effective quality 
assurance (QA) method that can rapidly qualify laser powder bed fusion 
(LPBF) processed hot gas path turbine components (HGPTCs) through 
a machine learning framework which would assimilate in-situ monitoring 
and measurement, ex-situ characterization, and simulation data.  The 
project technical deliverable will be a rapid QA tool capable of: i) building 
a metadata package of process-structure-property data and models 
intended for LPBF-processed HGPTCs by mining both simulation and in-
situ/ex-situ characterization data; and ii) qualifying online/offline a 
manufactured component by inputting simulation with/without in-situ 
monitoring data to the developed algorithms to predict porosity and 
fatigue properties. The target application of this QA tool will be 
advanced HGPTC produced by LPBF in Inconel 718. Data mining 
techniques will be developed to consolidate and analyze the 
heterogeneous big data stemmed from the aforementioned methods of 
upfront simulation, online monitoring and post-build characterization, and 
thus enabling a collaborative learning about the process-microstructure-
properties relationship. The resultant QA package includes a process-
structure-property database and machine learning tools for using LPBF 
metal AM to fabricate HGPTC. The developed metadata package 
enables online/offline qualification of additively manufactured turbine 
components by inputting simulation with/without in-situ monitoring data 
to the developed machine learning algorithms to predict porosity and 
fatigue properties.",primary goal project develop quality assurance qa method rapidly qualify laser powder bed fusion lpbf processed hot gas path turbine components hgptcs machine learning framework would assimilate monitoring measurement characterization simulation data project technical deliverable rapid qa tool capable building metadata package data models intended hgptcs mining simulation characterization data ii qualifying manufactured component inputting simulation monitoring data developed algorithms predict porosity fatigue properties target application qa tool advanced hgptc produced lpbf inconel data mining techniques developed consolidate analyze heterogeneous big data stemmed aforementioned methods upfront simulation online monitoring characterization thus enabling collaborative learning properties relationship resultant qa package includes database machine learning tools using lpbf metal fabricate hgptc developed metadata package enables qualification additively manufactured turbine components inputting simulation monitoring data developed machine learning algorithms predict porosity fatigue properties,5,Asset management
382,To provide combustion performance and emissions optimization through integration of a miniaturized high- temperature multi process monitoring system,National Energy Technology Laboratory,Department of Energy,DOE,,"Project will develop control logic for automated control of lignite coal-
fired boiler. Plant operational data will be compared against monitoring 
data to determine when different sensor output from a miniaturized high 
temperature multi-process, high-spatial-resolution monitoring system 
signifies damaging conditions in that region of the boiler, and what 
operational changes can be made to eliminate the damaging condition. 
The control logic will be developed for automated control of soot-blowing 
and other boiler operations",project develop control logic automated control lignite fired boiler plant operational data compared monitoring data determine different sensor output miniaturized high temperature monitoring system signifies damaging conditions region boiler operational changes made eliminate damaging condition control logic developed automated control boiler operations,19,Asset management
383,To provide insights into opportunities to beneficiate and use hydrocarbon infrastructure for alternative uses such as offshore carbon storage.,National Energy Technology Laboratory,Department of Energy,DOE,"BIG DATA, OTHER","Multiple big data-driven AI/ML models will be used to evaluate geologic, 
geospatial, and infrastructure related information to inform predictions 
using natural language processing, Artificial Neural Networks, and 
possibly bayesian networks as well.",multiple big models used evaluate geologic geospatial infrastructure related information inform predictions using natural language processing artificial neural networks possibly bayesian networks well,12,Service delivery
384,To provide integrated boiler management through advanced condition monitoring and component assessment.,National Energy Technology Laboratory,Department of Energy,DOE,,"The Integrated Creep-Fatigue Management System represents an 
online boiler damage monitoring system applicable to creep and fatigue.  
The system will be configured to allow connectivity to the plant data 
historian (e.g., OSISoft:PI) and to commercial finite element software 
(e.g., ANSYS and Abaqus). In addition to configuring interaction with 
finite element software, existing damage mechanism monitoring 
modules will also be deployed using online analytical calculations. This 
functionality will be applied to terminal tubes entering the boiler header 
for which the combined mechanisms of creep and oxidation can be 
calculated without the need for a finite element analysis.",integrated management system represents online boiler damage monitoring system applicable creep fatigue system configured allow connectivity plant data historian osisoft pi commercial finite element software ansys abaqus addition configuring interaction finite element software existing damage mechanism monitoring modules also deployed using online analytical calculations functionality applied terminal tubes entering boiler header combined mechanisms creep oxidation calculated without need finite element analysis,19,Asset management
