,Title,Agency,Department,Department_code,Techniques,Summary,Processed_Summary,Cluster,topics
253,Automated sorting of high repetition rate coherent diffraction data from XFELS,Brookhaven National Laboratory,Department of Energy,DOE,,"""Coherent X-rays are routinely provided today by the latest Synchrotron 
and X-ray Free-electron Laser Sources. When these diffract from a 
crystal containing defects, interference leads to the formation of a 
modulated diffraction pattern called """"speckle"""". When the defects move 
around, they can be quantified by a correlation analysis technique called 
X-ray Photon Correlation Spectroscopy. But the speckles also change 
when the beam moves on the sample. By scanning the beam in a 
controlled way, the overlap between the adjacent regions gives 
redundancy to the data, which allows a solution of the inherent phase 
problem. This is the basis of the coherent X-ray ptychography method 
which can achieve image resolutions of 10nm, but only if the probe 
positions are known.
The goal of this proposal will be to separate """"genuine"""" fluctuations of a 
material sample from the inherent beam fluctuations at the high data 
rates of XFELs. Algorithms will be developed to calculate the 
correlations between all the coherent diffraction patterns arriving in a 
time series, then used to separate the two sources of fluctuation using 
the criterion that the """"natural"""" thermal fluctuations do not repeat, while 
beam ones do.  We separate the data stream into image and beam 
""""modes"""" automatically.""",coherent routinely provided today latest synchrotron laser sources diffract crystal containing defects interference leads formation modulated diffraction pattern called speckle defects move around quantified correlation analysis technique called photon correlation spectroscopy speckles also change beam moves sample scanning beam controlled way overlap adjacent regions gives redundancy data allows solution inherent phase problem basis coherent ptychography method achieve image resolutions probe positions known goal proposal separate genuine fluctuations material sample inherent beam fluctuations high data rates xfels algorithms developed calculate correlations coherent diffraction patterns arriving time series used separate two sources fluctuation using criterion natural thermal fluctuations repeat beam ones separate data stream image beam modes automatically,7,"Internal operations: administrative use cases for AI, e.g. notetaking, virtual assistants"
254,Machine Learning for Autonomous Control of Scientific User Facilities,Brookhaven National Laboratory,Department of Energy,DOE,ML,"BNL will work alongside SLAC, to implement ML algorithm(s) into NSLS-
II Operations to interpret accelerator data more intelligently.  We intend 
to train said algorithms with 5+ years of archived device-data from 
accelerator components, records of previous fault causes (to connect to 
data-symptoms) and stored beam current.",bnl work alongside slac implement ml algorithm ii operations interpret accelerator data intelligently intend train said algorithms years archived accelerator components records previous fault causes connect stored beam current,8,Asset management
255,SMMM,Brookhaven National Laboratory,Department of Energy,DOE,"AI, ML","AI/ML is being used to evaluate measurements in real-time during 
simultaneous experiments on two beamlines and then drive subsequent 
data collection on both of the beamlines to maximize the scientific value 
generated per time.",used evaluate measurements simultaneous experiments two beamlines drive subsequent data collection beamlines maximize scientific value generated per time,16,Service delivery
256,AI Denoising,Fermi National Accelerator,Department of Energy,DOE,"ARTIFICIAL INTELLIGENCE, BIG DATA, NEURAL NETWORKS, HIERARCHICAL GENERATIVE MODEL","This program aims to develop generative models for quickly simulating 
showers of particles in calorimeters for LHC experiments",program aims develop generative models quickly simulating showers particles calorimeters lhc experiments,16,Topic: Asset management
257,Extreme data reduction for the edge,Fermi National Accelerator,Department of Energy,DOE,"ARTIFICIAL INTELLIGENCE, BIG DATA, NEURAL NETWORKS, NOVEL SPECTROSCOPIC TECHNOLOGY","This projects develops AI algorithms and tools for near-sensor data 
reduction in custom hardware.",projects develops ai algorithms tools data reduction custom hardware,16,Service delivery
258,High-Velocity AI: Generative Models,Fermi National Accelerator,Department of Energy,DOE,"ARTIFICIAL INTELLIGENCE, BIG DATA, NEURAL NETWORKS, HIERARCHICAL GENERATIVE MODEL","This project has two parts: 1. generating adversarial examples and then 
using domain adaptation and other techniques to improve the 
robustness of AI classification algorithms against those attacks 
(focusing on astrophysics/cosmology applications); 2. using AI 
algorithms to improve the output of low-quality classical simulation 
engines to deliver a high-quality result at high speed.",project two parts generating adversarial examples using domain adaptation techniques improve robustness ai classification algorithms attacks focusing applications using ai algorithms improve output classical simulation engines deliver result high speed,5,Topic: Internal Operations
259,hls4ml,Fermi National Accelerator,Department of Energy,DOE,"ARTIFICIAL INTELLIGENCE, BIG DATA, NEURAL NETWORKS","This project develops hardware-software AI codesign tools for FPGAs 
and ASICs for algorithms running at the extreme edge.",project develops ai codesign tools fpgas asics algorithms running extreme edge,18,Asset management
260,In-pixel AI for future tracking detectors,Fermi National Accelerator,Department of Energy,DOE,"ARTIFICIAL INTELLIGENCE, BIG DATA, NEURAL NETWORKS","This project explores novel  AI-on-chip technology for intelligent 
detectors embedded with sensing technology",project explores novel technology intelligent detectors embedded sensing technology,11,Service delivery
261,In-storage computing for multi- messenger astronomy in neutrino experiments and cosmological surveys,Fermi National Accelerator,Department of Energy,DOE,"ARTIFICIAL INTELLIGENCE, BIG DATA, NEURAL NETWORKS","This project aims to address the big-data challenges and stringent time 
constraints facing multi-messenger astronomy (MMA) in neutrino 
experiments and cosomological surveys. Instead of following the 
traditional computing paradigm of moving data to the compute 
elements, it does the opposite to embed computation in the data where 
processing is performed in situ. This will be achieved through emerging 
computational storage accelerators on which ML algorithms may be 
deployed to execute MMA tasks quickly so alerts can be disseminated 
promptly.",project aims address challenges stringent time constraints facing astronomy mma neutrino experiments cosomological surveys instead following traditional computing paradigm moving data compute elements opposite embed computation data processing performed situ achieved emerging computational storage accelerators ml algorithms may deployed execute mma tasks quickly alerts disseminated promptly,2,Topic: Other
262,Machine Learning for Accelerator Operations Using Big Data Analytics / L-CAPE,Fermi National Accelerator,Department of Energy,DOE,"ARTIFICIAL INTELLIGENCE, BIG DATA, NEURAL NETWORKS","Big data analytics for anomaly prediction and classification, enabling 
automatic mitigation, operational savings, and predictive maintenance of 
the Fermilab LINAC",big data analytics anomaly prediction classification enabling automatic mitigation operational savings predictive maintenance fermilab linac,8,Asset management: use of AI to manage both physical and digital assets
263,Machine Learning for Linac Improved Performance,Fermi National Accelerator,Department of Energy,DOE,"ARTIFICIAL INTELLIGENCE, BIG DATA, NEURAL NETWORKS","In Linacs at FNAL and J-PARC, the current emittance optimization 
procedure is limited to manual adjustments of a few parameters; using 
a larger number is not practically feasible for a human operator. Using 
machine learning (ML) techniques allows lifting this restriction and 
expanding this set. Our goal is to integrate ML into linac operation - and 
in particular RF control to achieve a more optimal longitudinal emittance 
and lower overall losses.",linacs fnal current emittance optimization procedure limited manual adjustments parameters using larger number practically feasible human operator using machine learning ml techniques allows lifting restriction expanding set goal integrate ml linac operation particular rf control achieve optimal longitudinal emittance lower overall losses,18,Topic: Asset management
264,Next-Generation Beam Cooling and Control with Optical Stochastic Cooling,Fermi National Accelerator,Department of Energy,DOE,"ARTIFICIAL INTELLIGENCE, BIG DATA, NEURAL NETWORKS","This program leverages the physics and technology of optical stochastic 
cooling (OSC) to explore new possibilities in beam control and sensing.  
The planned architecture and performance of a new OSC system at 
IOTA should enable turn-by-turn programmability of the high-gain OSC.  
This capability can then be used in conjunction with other hardware 
systems as the basis of an action space for reinforcement learning (RL) 
methods.  The program aims to establish a new state of the art in beam 
cooling and a flexible set of tools for beam control and sensing at 
colliders and other accelerator facilities.",program leverages physics technology optical stochastic cooling osc explore new possibilities beam control sensing planned architecture performance new osc system iota enable programmability osc capability used conjunction hardware systems basis action space reinforcement learning rl methods program aims establish new state art beam cooling flexible set tools beam control sensing colliders accelerator facilities,19,Topic: Asset management
265,READS: Real-time Edge AI for Distributed Systems,Fermi National Accelerator,Department of Energy,DOE,"ARTIFICIAL INTELLIGENCE, BIG DATA, NEURAL NETWORKS","This project will develop and deploy low-latency controls and prediction 
algorithms at the Fermilab accelerator complex",project develop deploy controls prediction algorithms fermilab accelerator complex,8,Service delivery:
266,Simulation-based inference for cosmology,Fermi National Accelerator,Department of Energy,DOE,"ARTIFICIAL INTELLIGENCE, BIG DATA, NEURAL NETWORKS","This project will develop and use simulation-based inference to estimate 
cosmological parameters related to cosmic acceleration in the early and 
late universe â via the cosmic microwave background and strong 
gravitational lensing, respectively. This will produce an analysis pipeline 
that can be deployed for next-generation cosmic surveys.",project develop use inference estimate cosmological parameters related cosmic acceleration early late universe via cosmic microwave background strong gravitational lensing respectively produce analysis pipeline deployed cosmic surveys,16,Topic_name: Internal operations
267,SONIC: AI acceleration as a service,Fermi National Accelerator,Department of Energy,DOE,"ARTIFICIAL INTELLIGENCE, BIG DATA, NEURAL NETWORKS","This project focuses on integration of AI hardware for at-scale inference 
acceleration for particle physics experiments.",project focuses integration ai hardware inference acceleration particle physics experiments,16,Service delivery: using AI to provide direct services either to the public or to state/local/tribal/territorial governments
268,Streamining intelligent detectors for sPHENIX/EIC,Fermi National Accelerator,Department of Energy,DOE,"ARTIFICIAL INTELLIGENCE, BIG DATA, NEURAL NETWORKS","This project develops real-time algorithms for event filtering with tracking 
detectors for nuclear physics collider experiments.",project develops algorithms event filtering tracking detectors nuclear physics collider experiments,16,Topic: Asset management
269,Uncertainty Quantification and Instrument Automation to enable next generation cosmological discoveries,Fermi National Accelerator,Department of Energy,DOE,"ARTIFICIAL INTELLIGENCE, BIG DATA, NEURAL NETWORKS","This project will develop AI-based tools to enable critical sectors for near-
future cosmic applications. Uncertainty quantification is essential for 
performing discovery science now, and simulation-based inference 
offers a new approach. The automated design and control of 
instrumentation will be important for improving the efficiency of planning 
and executing cosmic experiments.",project develop tools enable critical sectors future cosmic applications uncertainty quantification essential performing discovery science inference offers new approach automated design control instrumentation important improving efficiency planning executing cosmic experiments,16,Internal operations:
270,Deep Learning Malware Analysis for reusable cyber defenses.,Idaho National Laboratory,Department of Energy,DOE,MACHINE LEARNING,"The INL uses machine learning (feed forward neural network) on a large 
data set of translated malware binaries in graph structures to identify 
commonality between malware.",inl uses machine learning feed forward neural network large data set translated malware binaries graph structures identify commonality malware,18,Service delivery:
271,Geo Threat Observable for structure cyber threat related to the energy sector,Idaho National Laboratory,Department of Energy,DOE,,"Collection of open source threat inforamtion related to cyber issues in 
the energy sector, collected stored in graphdb and used in machine 
learning for similarities of threat enabling better reuse of cyber 
protections.",collection open source threat inforamtion related cyber issues energy sector collected stored graphdb used machine learning similarities threat enabling better reuse cyber protections,18,Service Delivery: use of AI to provide direct services either to the public or to state/local/tribal/territorial governments
272,"Advanced energy, batteries, and industrial efficiency",Lawrence Livermore National Laboratory,Department of Energy,DOE,,"Leveraging data science to navigate design space for better batteries 
and energy storage as well as scale up of various technologies",leveraging data science navigate design space better batteries energy storage well scale various technologies,10,"""Asset management"""
273,"Advanced materials science, engineering, and exploration relevant to the other key technology focus areas",Lawrence Livermore National Laboratory,Department of Energy,DOE,MACHINE LEARNING,"Enabling machine learning based technology to specialized materials for 
superior performance for scientific research and manufacturing systems",enabling machine learning based technology specialized materials superior performance scientific research manufacturing systems,11,Asset management
274,AI/ML and other software advances,Lawrence Livermore National Laboratory,Department of Energy,DOE,,"Model architecture development research, including workflows, 
algorithm and performance optimization",model architecture development research including workflows algorithm performance optimization,0,Service / benefits access
275,"Biology, genomics, and synthetic biology",Lawrence Livermore National Laboratory,Department of Energy,DOE,,"Combining experimental and computational methods to perform 
fundamental and applied research in genomics, molecular toxicology, 
nanotechnology, hostâpathogen biology, structural biology, genetics, 
microbial systems, and medical countermeasures",combining experimental computational methods perform fundamental applied research genomics molecular toxicology nanotechnology biology structural biology genetics microbial systems medical countermeasures,12,Topic: Other
276,"Cyber security, data storage, and data management technologies",Lawrence Livermore National Laboratory,Department of Energy,DOE,,"Data-processing pipelines and user interfaces to process and 
aggregate large, bulk, and possibly unstructured datasets allowing for 
search and export of data for further analysis in secure way",pipelines user interfaces process aggregate large bulk possibly unstructured datasets allowing search export data analysis secure way,18,"""Asset management: use of AI to manage both physical and digital assets"""
277,"High-performance computing, semiconductors, and advanced computer hardware",Lawrence Livermore National Laboratory,Department of Energy,DOE,,"Novel computer hardware architecture/configurations that can perform 
at the edge and/or in harsh environments",novel computer hardware perform edge harsh environments,16,Asset management
278,"Innovation methods, processes and promising practices that can affect the speed and effectiveness of innovation processes at scale.",Lawrence Livermore National Laboratory,Department of Energy,DOE,,"Computational approaches that lead to faster insights into the 
development and deployment of large scale operations",computational approaches lead faster insights development deployment large scale operations,18,Service Delivery
279,Natural and anthropogenic disaster prevention and mitigation,Lawrence Livermore National Laboratory,Department of Energy,DOE,,"Leveraging a broad, multimodal data stream to predict and understand 
natural disaster scenarios for the purposes of prevention and mitigation",leveraging broad multimodal data stream predict understand natural disaster scenarios purposes prevention mitigation,17,Service / benefits access
280,Quantum computing and information systems,Lawrence Livermore National Laboratory,Department of Energy,DOE,MACHINE LEARNING,"Machine learning and quantum computing applied towards optimization, 
quantum chemistry, material science, and cryptography",machine learning quantum computing applied towards optimization quantum chemistry material science cryptography,0,Service delivery
281,"Robotics, automation, and advanced manufacturing",Lawrence Livermore National Laboratory,Department of Energy,DOE,AI,"AI is being used for accelerating hardware development and 
interpretation of sensor data to improve process reliability",ai used accelerating hardware development interpretation sensor data improve process reliability,15,Service delivery
282,Advanced Image Segmentation,National Energy Technology Laboratory,Department of Energy,DOE,"NEURAL NETWORKS, OTHER","U-Net CNN segmentation to isolate pore and fluid from computed 
tomography scans of multiphase transport in cores.",cnn segmentation isolate pore fluid computed tomography scans multiphase transport cores,3,Service delivery
283,Advanced model to forecast offshore landslide risks and marine geohazards,National Energy Technology Laboratory,Department of Energy,DOE,"BIG DATA, NATURAL LANGUAGE PROCESSING, OTHER","This research will use data and models from the Offshore Risk Modeling 
(ORM) with intelligent databases, artificial intelligence (AI)/ML, big data, 
and other advanced computing technologies to address offshore 
subsurface natural-engineered system challenges, such as 
characterization and mapping of geologic hazards, safe operations, 
equipment reliability, and environmental assessments.",research use data models offshore risk modeling orm intelligent databases artificial intelligence ai big data advanced computing technologies address offshore subsurface system challenges characterization mapping geologic hazards safe operations equipment reliability environmental assessments,11,Service delivery
284,AI used to interpret sensor data.,National Energy Technology Laboratory,Department of Energy,DOE,OTHER,"AI is being used to classify sensor data.  An AI algorithm was written 
and trained with a wide range of known sensor conditions to enable 
automatic classification of sensor data into likely constituent gas 
concentrations.",ai used classify sensor data ai algorithm written trained wide range known sensor conditions enable automatic classification sensor data likely constituent gas concentrations,15,"""Asset management"""
285,"AI/ML may be needed to extract data from text, image and tabular- based resources. NEWTS is partnering with university teams to use ML to fill in data gaps using predictive models.",National Energy Technology Laboratory,Department of Energy,DOE,"NATURAL LANGUAGE PROCESSING, OTHER","NEWTS data requirements and database structure needs will be 
established by reviewing datasets and literature on energy-water 
streams. Data sources will be identified from regulatory agencies, 
government monitoring programs, as well as open-source literature. 
Metadata of each source will be compiled into a data catalog for 
tracking and reference. Datasets, including high-quality composition 
data for relevant streams, will be collected and downloaded. Acquired 
data will be processed into a structured format based on the 
prioritization of datasets to be included in NEWTS. Data acquisition and 
processing might entail the application of ML (e.g., natural language 
processing) to efficiently resurrect data trapped in historical reports 
(e.g., PDFs) or other unstructured formats. One research product of this 
subtask will be a release of the data catalog, which will be made 
available on",newts data requirements database structure needs established reviewing datasets literature streams data sources identified regulatory agencies government monitoring programs well literature metadata source compiled data catalog tracking reference datasets including composition data relevant streams collected downloaded acquired data processed structured format based prioritization datasets included newts data acquisition processing might entail application ml natural language processing efficiently resurrect data trapped historical reports pdfs unstructured formats one research product subtask release data catalog made available,7,Topic: Asset management
286,AI/ML methodology for rapid design of sorbents tuned to specific ash impoundment and/or landfill requirements.,National Energy Technology Laboratory,Department of Energy,DOE,OTHER,"Computation of the descriptors (atomic property-weighted radial 
distribution functions) that will be used for the ML portion of the task; 
Fitting of a machine-learned model for the prediction of B sorption; 
Optimization and computational design of a sorbent for maximum 
sorption of B as a function of B concentration in the aqueous solution; 
Force field generation for an additional pollutant (if needed); Sorption 
calculations and ML fitting for the second pollutant (TBD); Optimization 
and computational design of a sorbent for maximum sorption of the 
second pollutant as a function of pollutant concentration in the aqueous 
solution.",computation descriptors atomic radial distribution functions used ml portion task fitting model prediction b sorption optimization computational design sorbent maximum sorption b function b concentration aqueous solution force field generation additional pollutant needed sorption calculations ml fitting second pollutant tbd optimization computational design sorbent maximum sorption second pollutant function pollutant concentration aqueous solution,0,Other
287,Analysis to Assess Offshore CCS Trends and Gaps,National Energy Technology Laboratory,Department of Energy,DOE,OTHER,"Providing expertise, input, and support for the development of a DOE 
(NETL/FECM) carbon storage technical resources catalog that 
facilitates searching for information about datasets, models and tools, 
publications and reports, and competencies resulting from DOE-
FECM/NETLâs offshore and CSP activities.  this project will complete a 
review and analysis of knowledge and data resources resulting from 
international offshore CCS projects. Outcomes of this analysis are 
expected to include the integration of key data and tools into the EDX-
hosted Open Carbon Storage Database and DisCO2ver platform (in 
development via the EDX4CCS FWP), as well as geo-data science 
based analysis and recommendations on geologic and metocean 
insights from international studies and their alignment or relevance to 
U.S. Federal offshore settings.",providing expertise input support development doe carbon storage technical resources catalog facilitates searching information datasets models tools publications reports competencies resulting offshore csp activities project complete review analysis knowledge data resources resulting international offshore ccs projects outcomes analysis expected include integration key data tools hosted open carbon storage database platform development via fwp well science based analysis recommendations geologic metocean insights international studies alignment relevance federal offshore settings,17,Topic: Asset management
288,ANN Submodels of Reaction Physics,National Energy Technology Laboratory,Department of Energy,DOE,OTHER,ANN development of flow physics for code acceleration,ann development flow physics code acceleration,16,Topic: Asset management
